{
  "$schema": "./packages.schema.json",
  "schemaVersion": 1,
  "solutions": [
    "Win64",
    "Win32",
    "PCSX2F",
    "PPSSPP",
    "Dolphin"
  ],
  "dependencies": {
    "loader-x86": {
      "archive": "Ultimate-ASI-Loader.zip",
      "architecture": "x86",
      "tag": "latest",
      "repository": "ThirteenAG/Ultimate-ASI-Loader",
      "assetPattern": "^Ultimate-ASI-Loader\\.zip$"
    },
    "loader-x64": {
      "archive": "Ultimate-ASI-Loader_x64.zip",
      "architecture": "x64",
      "tag": "latest",
      "repository": "ThirteenAG/Ultimate-ASI-Loader",
      "assetPattern": "^Ultimate-ASI-Loader_x64\\.zip$"
    },
    "xidi": {
      "archive": "xidi.zip",
      "architecture": "x86",
      "tag": "latest",
      "repository": "ThirteenAG/Xidi",
      "assetPattern": "^Xidi.*\\.zip$"
    },
    "xidi-sdl3": {
      "archive": "Xidi-SDL3-Plugin.zip",
      "architecture": "x86",
      "tag": "latest",
      "repository": "RibShark/Xidi-SDL3-Plugin",
      "assetPattern": "^Xidi-SDL3-Plugin.*\\.zip$"
    },
    "dsoal": {
      "archive": "DSOAL.zip",
      "architecture": "x86",
      "nestedMember": "*.zip",
      "tag": "archive",
      "repository": "kcat/dsoal",
      "selection": "highest-revision",
      "assetPattern": "^DSOAL_r\\d+\\.zip$"
    }
  },
  "packages": [
    {
      "id": "Bully.WidescreenFix",
      "producers": [
        {
          "project": "Bully.WidescreenFix",
          "solution": "Win32",
          "source": "data/Bully.WidescreenFix/plugins/Bully.WidescreenFix.asi",
          "destination": "plugins/Bully.WidescreenFix.asi",
          "embedPdb": "if-present",
          "sign": true
        }
      ],
      "files": [],
      "dependencies": [
        {
          "id": "loader-x86",
          "member": "*.dll",
          "destination": "dinput8.dll"
        }
      ]
    },
    {
      "id": "Burnout3.PCSX2F.WidescreenFix",
      "producers": [
        {
          "project": "Burnout3.PCSX2F.WidescreenFix",
          "solution": "PCSX2F",
          "source": "data/Burnout3.PCSX2F.WidescreenFix/PLUGINS/Burnout3.PCSX2F.WidescreenFix.elf",
          "destination": "PLUGINS/Burnout3.PCSX2F.WidescreenFix.elf"
        }
      ],
      "files": [
        {
          "source": "data/Burnout3.PCSX2F.WidescreenFix/PLUGINS/Burnout3.PCSX2F.WidescreenFix.asisettings.json",
          "destination": "PLUGINS/Burnout3.PCSX2F.WidescreenFix.asisettings.json"
        },
        {
          "source": "data/Burnout3.PCSX2F.WidescreenFix/PLUGINS/Burnout3.PCSX2F.WidescreenFix.asisettings.en.json",
          "destination": "PLUGINS/Burnout3.PCSX2F.WidescreenFix.asisettings.en.json"
        }
      ],
      "dependencies": []
    },
    {
      "id": "CallOfCthulhu.WidescreenFix",
      "producers": [
        {
          "project": "CallOfCthulhu.WidescreenFix",
          "solution": "Win32",
          "source": "data/CallOfCthulhu.WidescreenFix/Engine/scripts/CallOfCthulhu.WidescreenFix.asi",
          "destination": "Engine/scripts/CallOfCthulhu.WidescreenFix.asi",
          "embedPdb": "if-present",
          "sign": true
        }
      ],
      "files": [],
      "dependencies": [
        {
          "id": "loader-x86",
          "member": "*.dll",
          "destination": "Engine/dinput8.dll"
        }
      ]
    },
    {
      "id": "ColdFear.WidescreenFix",
      "producers": [
        {
          "project": "ColdFear.WidescreenFix",
          "solution": "Win32",
          "source": "data/ColdFear.WidescreenFix/scripts/ColdFear.WidescreenFix.asi",
          "destination": "scripts/ColdFear.WidescreenFix.asi",
          "embedPdb": "if-present",
          "sign": true
        }
      ],
      "files": [],
      "dependencies": [
        {
          "id": "loader-x86",
          "member": "*.dll",
          "destination": "winmm.dll"
        }
      ]
    },
    {
      "id": "Condemned.WidescreenFix",
      "producers": [
        {
          "project": "Condemned.WidescreenFix",
          "solution": "Win32",
          "source": "data/Condemned.WidescreenFix/scripts/Condemned.WidescreenFix.asi",
          "destination": "scripts/Condemned.WidescreenFix.asi",
          "embedPdb": "if-present",
          "sign": true
        }
      ],
      "files": [
        {
          "source": "data/Condemned.WidescreenFix/Game/CondemnedZ.Arch00",
          "destination": "Game/CondemnedZ.Arch00"
        },
        {
          "source": "data/Condemned.WidescreenFix/Xidi.ini",
          "destination": "Xidi.ini"
        },
        {
          "source": "data/Condemned.WidescreenFix/default.archcfg",
          "destination": "default.archcfg"
        },
        {
          "source": "data/Condemned.WidescreenFix/scripts/Xbox360ControlScheme.png",
          "destination": "scripts/Xbox360ControlScheme.png"
        }
      ],
      "dependencies": [
        {
          "id": "loader-x86",
          "member": "*.dll",
          "destination": "d3d9.dll"
        },
        {
          "id": "xidi",
          "member": "Xidi-*/Win32/dinput8.dll",
          "destination": "dinput8.dll"
        },
        {
          "id": "xidi",
          "member": "Xidi-*/Win32/Xidi.32.dll",
          "destination": "Xidi.32.dll"
        },
        {
          "id": "xidi-sdl3",
          "member": "SDL.XidiPlugin.32.dll",
          "destination": "SDL.XidiPlugin.32.dll"
        }
      ]
    },
    {
      "id": "DeerAvenger4.WidescreenFix",
      "producers": [
        {
          "project": "DeerAvenger4.WidescreenFix",
          "solution": "Win32",
          "source": "data/DeerAvenger4.WidescreenFix/scripts/DeerAvenger4.WidescreenFix.asi",
          "destination": "scripts/DeerAvenger4.WidescreenFix.asi",
          "embedPdb": "if-present",
          "sign": true
        }
      ],
      "files": [],
      "dependencies": [
        {
          "id": "loader-x86",
          "member": "*.dll",
          "destination": "ddraw.dll"
        }
      ]
    },
    {
      "id": "Driv3r.WidescreenFix",
      "producers": [
        {
          "project": "Driv3r.WidescreenFix",
          "solution": "Win32",
          "source": "data/Driv3r.WidescreenFix/scripts/Driv3r.WidescreenFix.asi",
          "destination": "scripts/Driv3r.WidescreenFix.asi",
          "embedPdb": "if-present",
          "sign": true
        }
      ],
      "files": [],
      "dependencies": [
        {
          "id": "loader-x86",
          "member": "*.dll",
          "destination": "dinput8.dll"
        }
      ]
    },
    {
      "id": "DriverParallelLines.WidescreenFix",
      "producers": [
        {
          "project": "DriverParallelLines.WidescreenFix",
          "solution": "Win32",
          "source": "data/DriverParallelLines.WidescreenFix/scripts/DriverParallelLines.WidescreenFix.asi",
          "destination": "scripts/DriverParallelLines.WidescreenFix.asi",
          "embedPdb": "if-present",
          "sign": true
        }
      ],
      "files": [],
      "dependencies": [
        {
          "id": "loader-x86",
          "member": "*.dll",
          "destination": "dinput8.dll"
        }
      ]
    },
    {
      "id": "EnterTheMatrix.WidescreenFix",
      "producers": [
        {
          "project": "EnterTheMatrix.WidescreenFix",
          "solution": "Win32",
          "source": "data/EnterTheMatrix.WidescreenFix/scripts/EnterTheMatrix.WidescreenFix.asi",
          "destination": "scripts/EnterTheMatrix.WidescreenFix.asi",
          "embedPdb": "if-present",
          "sign": true
        }
      ],
      "files": [],
      "dependencies": [
        {
          "id": "loader-x86",
          "member": "*.dll",
          "destination": "d3d9.dll"
        }
      ]
    },
    {
      "id": "FarCry.WidescreenFix",
      "producers": [
        {
          "project": "FarCry.WidescreenFix",
          "solution": "Win32",
          "source": "data/FarCry.WidescreenFix/Bin32/FarCry.WidescreenFix.asi",
          "destination": "Bin32/FarCry.WidescreenFix.asi",
          "embedPdb": "if-present",
          "sign": true
        },
        {
          "project": "FarCry64.WidescreenFix",
          "solution": "Win64",
          "source": "data/FarCry.WidescreenFix/Bin64/FarCry64.WidescreenFix.asi",
          "destination": "Bin64/FarCry64.WidescreenFix.asi",
          "embedPdb": "if-present",
          "sign": true
        }
      ],
      "files": [],
      "dependencies": [
        {
          "id": "loader-x86",
          "member": "*.dll",
          "destination": "Bin32/version.dll"
        },
        {
          "id": "loader-x64",
          "member": "*.dll",
          "destination": "Bin64/version.dll"
        }
      ]
    },
    {
      "id": "GTA1.WidescreenFix",
      "producers": [
        {
          "project": "GTA1.WidescreenFix",
          "solution": "Win32",
          "source": "data/GTA1.WidescreenFix/WINO/scripts/GTA1.WidescreenFix.asi",
          "destination": "WINO/scripts/GTA1.WidescreenFix.asi",
          "embedPdb": "if-present",
          "sign": true
        }
      ],
      "files": [],
      "dependencies": [
        {
          "id": "loader-x86",
          "member": "*.dll",
          "destination": "WINO/ddraw.dll"
        }
      ]
    },
    {
      "id": "GTA2.WidescreenFix",
      "producers": [
        {
          "project": "GTA2.WidescreenFix",
          "solution": "Win32",
          "source": "data/GTA2.WidescreenFix/scripts/GTA2.WidescreenFix.asi",
          "destination": "scripts/GTA2.WidescreenFix.asi",
          "embedPdb": "if-present",
          "sign": true
        }
      ],
      "files": [],
      "dependencies": [
        {
          "id": "loader-x86",
          "member": "*.dll",
          "destination": "ddraw.dll"
        }
      ]
    },
    {
      "id": "GTA3.WidescreenFix",
      "producers": [
        {
          "project": "GTA3.WidescreenFix",
          "solution": "Win32",
          "source": "data/GTA3.WidescreenFix/scripts/GTA3.WidescreenFix.asi",